Title,Sport,Year
Conservative Lawmakers Say Banning Trans Youth From Sports Will Keep the Competition Fair. Some Harvard D1 Athletes Disagree.,Men's Swimming,2022
Football to Face St. Thomas in Home-and-Home Series in 2023 and 2029,Football,2022
For Gold,Sports Features,2022
I Am Speed,Skiing,2022
Hitting the (Xiaohaituo) Slopes: Sophomore Nordic Skiing Standout Drolet Competes in Beijing,Skiing,2022
"Okay, AK",Men's Lacrosse,2022
Nothing But Net,Men's Lacrosse,2022
"Goals On and Off the Field: Fred Asare-Konadu Gives Back to Florida Youth, Seeks Legislative Changes in Washington",Men's Lacrosse,2022
Wimberly's Winner,Football,2022
Kym-Possible to Bring Down,Football,2022
Hero of Harvard-Yale: Inside Kym Wimberly's Decision to Run it Back,Football,2022
Men's Ice Hockey's Abruzzese and Farrell Selected for Team USA in 2022 Olympics,Men's Ice Hockey,2022
Concentra-sean,Men's Ice Hockey,2022
Keely Moy to Represent Switzerland in 2022 Olympics,Women's Ice Hockey,2022
Going for Go(a)ld,Women's Ice Hockey,2022
"Men's Lacrosse Co-Captain Olmert Reflects on Leadership Role, Provides Keys for 2022 Season",Men's Lacrosse,2021
"From Harare to Pretoria to Cambridge, Twins Rory and Pat Plunket Are Making Waves",Men's Crew,2021
Men’s and Women’s Cross Country Both Turn in Top-25 Finishes at NCAAs,Track and Cross Country,2021
Harvard Crew Wraps Up Fall at Foot of the Charles,Game Stories,2021
Women’s Hockey Spearheads Movement for Gender Equity in NCAA Tournament,Women's Ice Hockey,2021
From the Yale Daily News: Veritas Needs Lux,Football,2021
"Katey Stone Becomes First Female Head Coach to Reach 500 Wins, Leads Women’s Hockey to 6-3 Record",Women's Ice Hockey,2021
Former Harvard Men’s Basketball Standout and NBA Champion Jeremy Lin ’10 Appointed UNICEF USA Ambassador,Men's Basketball,2021
Field Hockey Advances to NCAA Final Four for First Time in Program History After Pair of 1-0 Victories,Field Hockey,2021
No. 12 Field Hockey Set to Face No. 6 Louisville in First Round of NCAA Tournament,Field Hockey,2021
Women’s Basketball Opens Historic Season with Road Loss to Boston College,Women's Basketball,2021
"Women's Soccer Wins At-Large Bid, Headed to the NCAA Tournament for the First Time Since 2016",Women's Soccer,2021
"No. 10 Women’s Hockey Defeats No. 7 Boston College, 5-2, Continuing Strong Start",Women's Ice Hockey,2021
"Women’s Cross Country Wins Ivy League Heptagonal Championship, Men Place Second Ahead of Regionals",Track and Cross Country,2021
Shouldering the Responsibility: Women’s Volleyball’s Julia Beckmann Captains Her Team Despite Medical Retirement,Women's Volleyball,2021
Men's Lacrosse Returns to Field for First Time since March 2020 in Fall Scrimmages,Men's Lacrosse,2021
"Ivy League Admits Officiating Error, But Princeton Football Remains Victorious over Harvard",Football,2021
A Family of Forbes: Siblings Reconnect with Harvard Basketball,Men's Basketball,2021
Men’s Hockey Picked to Finish Third in ECAC Preseason Coaches Poll,Men's Ice Hockey,2021
Football Handles Nationally-Ranked Holy Cross 38-13 to Improve to 3-0,Football,2021
JuCo to the Show: Owen Holt’s Unorthodox Journey to Professional Baseball,Baseball,2021
"In Photos: Packed Stands, Historic Milestones, and 1-0 in the Ivy League",Football,2021
Undefeated Women’s Soccer Receives National Recognition ahead of Ivy League Opener,Women's Soccer,2021
"NOTEBOOK: Women’s Soccer Improves to 4-0-1 ahead of Final Pre-Ivy Matches, Best Start since 1996",Notebooks,2021
4-0-1,Notebooks,2021
Aiming Towards a New Goal,Sports Features,2021
The 98 Percent: NIL and a New Era of Opportunity for Harvard Student-Athletes,Sports Features,2021
Shooting From a Distance,Sports Features,2021
Weekend Sports 9-5-21 Photo Essay 9,Men's Water Polo,2021
Weekend Sports 9-5-21 Photo Essay 10,Men's Water Polo,2021
Weekend Sports 9-5-21 Photo Essay 11,Men's Water Polo,2021
Weekend Sports 9-5-21 Photo Essay 8,Women's Soccer,2021
Weekend Sports 9-5-21 Photo Essay 5,Women's Rugby,2021
Weekend Sports 9-5-21 Photo Essay 4,Women's Rugby,2021
Weekend Sports 9-5-21 Photo Essay 6,Women's Soccer,2021
In Photos: Harvard Athletic Events Return to Campus in Full Force,Women's Soccer,2021
Weekend Sports 9-5-21 Photo Essay 10,Men's Water Polo,2021
Weekend Sports 9-5-21 Photo Essay 5,Women's Rugby,2021
Weekend Sports 9-5-21 Photo Essay 11,Men's Water Polo,2021
Weekend Sports 9-5-21 Photo Essay 6,Women's Soccer,2021
Skyline Swim,Men's Water Polo,2021
Out for a Swim,Men's Water Polo,2021
Just Keep Swimming: From Blodgett Pool to Manhattan Rivers,Men's Water Polo,2021
Olympian for Life,Olympics,2021
Olympians for Life: A Recap of Harvard’s Student-Athletes at the 2020 Tokyo Games,Olympics,2021
"With the Olympics Around the Corner, Harvard and Radcliffe Rowers Prepare to Make Their Mark",Men's Crew,2021
Going for Gold,Men's Crew,2021
Senior Perspective: Gabrielle Fernandopulle,Women's Rugby,2021
Senior Perspective: Matt Thomas,Baseball,2021
Dillon Field House,Sports Features,2021
It Takes Two to Tackle Jarrell,Women's Rugby,2021
Women's Squash Team's Sweet Taste of Victory,Women's Squash,2021
Athletes on Leave Tree Map,Sports Features,2021
'Love First': How RuQuan Brown Bounces Back and Makes a Difference,Football,2021
Post Player: Former Women’s Basketball Captain Jacqueline Alemany Covers Congress for The Washington Post,Women's Basketball,2021
Moy Siblings Make a Transatlantic Leap,Men's Ice Hockey,2021
Harvard Women’s Rugby Standouts One Step Closer to Representing the United States on Rugby’s Biggest Stage,Women's Rugby,2021
"A Note to Readers: The Last Supplement of Its Kind, Hopefully",Sports Features,2021
Beginnings and Endings: Parting Shot,Sports Features,2021
"Life on the Tour: Amanda Sobhy ’15, Haley Mendez ’15, and Sabrina Sobhy ’19 Reflect on Time at Harvard, Pro Squash Careers",Women's Squash,2021
Harvard Women’s Rugby Standouts One Step Closer to Representing the United States on Rugby’s Biggest Stage,Women's Rugby,2021
"A Note to Readers: The Last Supplement of Its Kind, Hopefully",Sports Features,2021
Love1,Football,2021
Thomas Tees Off,Baseball,2021
Multi-Positional Star,Football,2021
Speedy Spiral,Women's Rugby,2021
To the Hoop,Women's Basketball,2021
Fernandopulle Finds the Try Zone,Women's Rugby,2021
Mask Up,Women's Rugby,2021
Bargell Breaks Through Defender,Women's Rugby,2021
Giving 100 Purcent,Women's Soccer,2021
The Game '16,Sports Features,2021
From Guard to The Post,Women's Basketball,2021
Head Up,Men's Ice Hockey,2021
To the Goal,Women's Soccer,2021
Celly Time,Women's Soccer,2021
Midfielder Lara Schenk Finds Ways to Train Among the Best Despite Pandemic,Women's Soccer,2021
One Year Later: Harvard Student-Athletes Reflect on Lack of Ivy League Competition Since Last March,Ivy League,2021
Reason to Celebrate,Men's Ice Hockey,2021
Run with a View,Track and Cross Country,2021
Welcome to the Lion's Den,Women's Ice Hockey,2021
Walking on Water,Women's Swimming,2021
Off the Blocks,Women's Swimming,2021
"Tri-Captain of Women’s Swim and Dive Team, Cassandra Pasadyn, Activates Advanced Standing",Women's Swimming,2021
"Across the Atlantic, Crouin's Work Ethic Remains Strong",Men's Squash,2021
Not Throwing Away His Shot: How Alexander Kolesnikoff is Reaching New Heights – and Distances – amid a Global Pandemic,Track and Cross Country,2021
A Note to Readers: 365 Days Later,Sports Features,2021
"Tri-Captain of Women’s Swim and Dive Team, Cassandra Pasadyn, Activates Advanced Standing",Women's Swimming,2021
Committed: How Harvard Basketball Has Recruited in a Pandemic,Men's Basketball,2021
A Player’s Coach: Dom Petrie Stays Connected to the Game and Mentors the Next Generation of Girls,Women's Ice Hockey,2021
Flipped Classroom: Elizabeth Miclau Trains for Diving World Championships,Women's Swimming,2021
Reason to Celebrate,Men's Ice Hockey,2021
"With Players Scattered Across the Country, Men’s Hockey Prepares for Uncertain Post-Covid Future",Men's Ice Hockey,2021
One Year Later: Harvard Student-Athletes Reflect on Lack of Ivy League Competition Since Last March,Ivy League,2021
Just one of many options for Coach Delaney-Smith's Zoom background on calls with recruits,Women's Basketball,2021
365 Days Unlike Any Other,Sports Features,2021
Kirkwood Remains Focused,Men's Basketball,2021
Welcome to the Lion's Den,Women's Ice Hockey,2021
"Across the Atlantic, Crouin's Work Ethic Remains Strong",Men's Squash,2021
Run with a View,Track and Cross Country,2021
3 TDs in 3 OTs,Football,2021
Not Just TDs (FGs Too),Football,2021
"Brate '14 Set to Appear in Super Bowl LV, Marking Back-to-Back Years with Harvard Alum in Game",Football,2021
Former Crimson Infielder Peter Woodfork ‘99 Reflects on His Path from Harvard Baseball to Overseeing Minor League Operations,Baseball,2020
Old Stomping Grounds,Baseball,2020
"From the Water to a Farm, Caroline Noble Makes Her Mark",Women's Crew,2020
Water-to-Farm-to-Table,Women's Crew,2020
A Whole New Ballgame,Baseball,2020
Going Yard?,Baseball,2020
Farm Fresh,Women's Crew,2020
"From the Water to a Farm, Caroline Noble Makes Her Mark",Women's Crew,2020
Australian First-Year Student-Athletes Navigate the New Normal,Sports Features,2020
On the Open Water,Men's Crew,2020
Victory,Men's Crew,2020
Winding Up,Men's Crew,2020
Not This Year,Sports Features,2020
Contact Sport to Combat Sport,Football,2020
Slugger,Baseball,2020
History 1852: Finding Sports When Sports Are Hard to Find,Sports Features,2020
First-Year Linebacker Considers Amateur MMA Fighting in Place of Spring Semester,Football,2020
Suddleson Steadfast Despite Lost Season,Baseball,2020
Marathon with a Meaning,Women's Crew,2020
Marathon Fundraiser,Women's Crew,2020
Game Face,Women's Rugby,2020
"With 12-Hour Time Differences and Unprecedented Uncertainty, Rugby Standout Sofie Fella Embraces the New Normal",Women's Rugby,2020
Huddle Up,Women's Rugby,2020
Black Lives Matter,Sports Features,2020
Bigger than Basketball,Sports Features,2020
30 Years Later: The Historic Season That Harvard Women’s Lacrosse Was Perfect,Women's Lacrosse,2020
To Be a Student-Athlete,Women's Lacrosse,2020
Senior Celebration,Women's Lacrosse,2020
Pre-Game Hype,Women's Lacrosse,2020
The Champions,Women's Lacrosse,2020
2020 Vision,Men's Basketball,2020
Head Coach,Men's Basketball,2020
Senior Perspective: Grace Eysenbach — Learning from Imperfect Ending,Women's Crew,2020
"No Shoe, No Problem: Kieran Tuntivate, Male Athlete of the Year",Track and Cross Country,2020
"A ‘Quiet Warrior’: Gina Kennedy, Female Athlete of the Year",Women's Squash,2020
"The Game for the Ages: Football vs. Yale, Heartbreak of the Year",Football,2020
"Setting Her Own Pace: Abbe Goldstein, Comeback of the Year",Track and Cross Country,2020
‘A Unicorn Class’: Women's Soccer Welcomes Historic Recruiting Class,Women's Soccer,2020
‘She Wouldn’t Back Down’: Inside Incoming Athletic Director Erin McDermott’s College Basketball Career,Women's Basketball,2020
"It's Lonely at the Top: Women's Rugby, National Champs and Team of the Year",Women's Rugby,2020
"Number 200: Men’s Water Polo vs. Princeton, Game of the Year",Men's Water Polo,2020
Senior Perspective: Jake Suddleson,Baseball,2020
Senior Perspective: Justin Bassey,Men's Basketball,2020
"Seconds Ahead of Second: Felicia Pasadyn, Female Rookie of the Year",Women's Swimming,2020
"Another Accolade: Nick Abruzzese, Male Rookie of the Year",Men's Ice Hockey,2020
A Note to Readers: A Year in Sports Unlike Any Other,Year in Sports,2020
"Catch Him if You Can: Aidan Borguet vs. Yale, Individual Performance of the Year",Football,2020
"‘This Is Why We Get Skated So Much’: Women’s Ice Hockey Outlasts Yale, Team Performance of the Year",Women's Ice Hockey,2020
Men's Hockey 2019-2020 Season Recap,Men's Ice Hockey,2020
Youth Proves to be the Aces of Harvard Tennis in Abbreviated Season,Men's Tennis,2020
Doubling Down on Youth,Men's Tennis,2020
"Pass First, But Score Too",Women's Basketball,2020
"Changing Course, Former Harvard Basketball Star Benzan Lands on Maryland for Post-Grad Season",Women's Basketball,2020
"Stars, Stripes, and Oars",Features,2020
Clark Dean’s Olympic Training Put on Pause,Features,2020
Going Home: Bryce Aiken Announces Transfer to Seton Hall,Men's Basketball,2020
Coronavirus Puts Harvard Fencer Elizabeth Tartakovsky’s Olympic Dream On Hold,Features,2020
"Much to Give, Plenty to Prove: Seth Towns Returns Home",Men's Basketball,2020
Five-Minute Overtime: Men's Basketball's Post-Practice Drill Pays Dividends,Men's Basketball,2020
"“Stress with Answers:"" Gina Kennedy and Navigating Pressure in Elite Squash",Features,2020
Farther than Farley,Men's Basketball,2020
Three More,Men's Basketball,2020
The Long Road Back: Reed Farley's Return to Men's Basketball,Men's Basketball,2020
Crafting a New Identity: Women's Basketball Midseason Report,Women's Basketball,2020
No. 17 Men's Hockey Falls to No. 12 Northeastern in Beanpot Semifinal,Men's Ice Hockey,2020
All Business,Men's Basketball,2020
"On Education Day, Over One Thousand Local Kids Cheer on Women’s Basketball",Women's Basketball,2019
Harvard Men's Tennis' Family Dynasty: Bo and Lane Leschly,Men's Tennis,2019
Bo Ball,Men's Tennis,2019
Stay in Your Lane,Men's Tennis,2019
Where All the Action Happens: The Adams Housing Day Video,Football,2019
"Cool Story, Bro(gan)",Football,2019
"As Men’s Basketball Heads North, Two Journeys Come Full-Circle",Men's Basketball,2019
Gerry Byrne Set to Take the Reins of Harvard Men’s Lacrosse,Men's Lacrosse,2019
A Fresh But Uncertain Future: 2019-20 Harvard Women’s Basketball Preview,Women's Basketball,2019
High Expectations: 2019-20 Harvard Men's Basketball Preview,Men's Basketball,2019
From Soccer to Survivor: Kellee Kim '12 Competes on Long-Running CBS Show,Women's Soccer,2019
NCAA Greenlights Players Profiting Off of Image: What's Next?,Sports Features,2019
Healing Through Football: The Return of Hunt Sparks,Football,2019
"With Court to Corporate, Kirby Porter ’18 Aims to Reshape the Narrative Around Athletes in Business",Women's Basketball,2019
In Photos: 2019 Crimson Madness,Men's Basketball,2019
First-Year Athletes Impetus in Scooter Revolution,Sports Features,2019
Deals on Wheels,Sports Features,2019
Head of the Charles 2019,Men's Crew,2019
"Jon Morosi ‘04 Talks Baseball, Harvard, and Sports Journalism",Sports Features,2019
Nostalgia,Sports Features,2019
Leading and Learning Together,Sports Features,2019
Leading Together,Sports Features,2019
Born to Run,Sports Features,2019
A Warm Return,Sports Features,2019
Pit Stops?,Sports Features,2019
Harvard Junior Runs Nearly 70 Miles Back to College,Sports Features,2019
Thesis in Hand,Sports Features,2019
"Saves Galore: Ellie Shahbo, Female Rookie of the Year",Field Hockey,2019
Men’s Hockey 2018-2019 Season Recap,Men's Ice Hockey,2019
Data Feature — 10 Years Later: Where are They Now?,Sports Features,2019
Triple Play: Harvard Baseball's Stone Brothers,Baseball,2019
"Double-Clutch: Harvard Men's Basketball vs. Columbia, Game of the Year",Men's Basketball,2019
"One-Shoe Wonder: Kieran Tuntivate, Male Performance of the Year",Track and Cross Country,2019
"Record Time: Lisa Tertsch, Female Performance of the Year",Track and Cross Country,2019
"Freshman Phenom: Elizabeth Wang, Female Breakout Athlete of the Year",Women's Golf,2019
Senior Perspective: Robbie Feinberg,Men's Basketball,2019
"Nine in the Ninth: Baseball vs. Yale, Comeback of the Year",Baseball,2019
Squash Supreme: Both Men and Women are Teams of the Year,Men's Squash,2019
"Off to the Horses: Tjerk van Herwaarden, Coach of the Year",Field Hockey,2019
A Hockey Life: Bradley Fusco,Women's Ice Hockey,2019
"The Puck Stops Here: Lindsay Reed, Female Athlete of the Year",Women's Ice Hockey,2019
"Nine in the Ninth: Baseball vs. Yale, Comeback of the Year",Baseball,2019
"The Puck Stops Here: Lindsay Reed, Female Athlete of the Year",Women's Ice Hockey,2019
"All-American: Dean Farris, Male Athlete of the Year",Men's Swimming,2019
Alums 08-09 Survey,Sports Features,2019
Say Cheers,Sports Features,2019
Alums 08-09 Seniors,Sports Features,2019
Pupped Up,Sports Features,2019
Alums 08-09 Women's,Sports Features,2019
Alums 08-09 1,Sports Features,2019
Alums 08-09 Men's,Sports Features,2019
Full Circle: Hawaiian Freshmen Reunite at Harvard,Men's Volleyball,2019
Men's Hockey's Adam Fox Signs with New York Rangers,Men's Ice Hockey,2019
"Harvard Senior Larry Allen Jr. Signs with Dallas Cowboys, Continuing Father's Legacy",Football,2019
The Last Gymnasts of Hemenway,Club Sports,2019
Shaw Sets Ivy League Saves Record,Baseball,2019
Former Harvard Goalkeeper Matt Freese Debuts for MLS's Philadelphia Union,Men's Soccer,2019
The Welshman: Freshman Thrower Eyes Big Stage,Track and Cross Country,2019
The Commander of Soldiers Field: Jenny Allard’s Remarkable Career,Softball,2019
Leading the Way,Softball,2019
Hi-Energy Pitch,Softball,2019
Flashback: Harvard Splits Strange 2018 Ivy League Title,Softball,2019
Hometown Heroes: High School Teammates Reunite on Harvard Women’s Lacrosse,Women's Lacrosse,2019
Men's Hockey Announces Three Captains for 2019-2020,Men's Ice Hockey,2019
"As a Tandem, Harvard Senior to Compete with Lifelong Friend in Boston Marathon",Sports Features,2019
COLUMN: Authority Figures Must Learn from the Harvard Fencing Scandal,Fencing,2019
"As a Tandem, Harvard Senior to Compete with Lifelong Friend in Boston Marathon",Sports Features,2019
The Building Where It Happens,Sports Features,2019
Running for a Cause,Sports Features,2019
"First Baseman Patrick McColl Leads Team in Batting Average, Runs",Baseball,2019
It Runs in the Family: Matthew Ctvrtlik's Journey to the Ivy League,Men's Volleyball,2019
Thirty Years Later: Men's Hockey's 1989 National Title Inspires Upcoming NCAA Tournament Run,Men's Ice Hockey,2019
Men's Hockey In Photos: The 2018-2019 Regular Season,Men's Ice Hockey,2019
Harvard Curling Club: From Learn-To-Curl to Nationals,Sports Features,2019
Former Team USA Goalie Devon Wills Takes Reins for Women’s Lacrosse,Women's Lacrosse,2019
Picking up the Pace: Jovahn Williamson Spotlight,Track and Cross Country,2019
Reconnecting with the Golden Generation: Harvard Basketball in the 1940's,Men's Basketball,2019
20 Years Later: Reflecting on Harvard’s 1999 National Championship,Women's Ice Hockey,2019
The Rise of Michael Lackey,Men's Ice Hockey,2019
Women's Water Polo Still Perfect After Nine Games,Women's Water Polo,2019
Remembering Where He Came From: Five Minutes with Jeremy Lin,Men's Basketball,2019
The Supercharger: Rob Baker Sparks Men’s Basketball,Men's Basketball,2019
Remembering Where He Came From: Five Minutes with Jeremy Lin,Men's Basketball,2019
Triple Threat: The Rise of the Three-Pointer at Harvard,Men's Basketball,2019
Harvard Baseball Builds New Friendships in Dominican Republic Trip,Baseball,2019
Rugby's Recruiting Success and Its 2018 Run to the NIRA Championship Game,Features,2019
The Return of Bryce Aiken,Men's Basketball,2019
A Voice Beyond the Court for Harvard Basketball,Men's Basketball,2019
Men's Hockey's Jack Drury Earns Silver at World Junior Championship,Men's Ice Hockey,2019
In Photos: A Trip to Chapel Hill for Harvard Men's Basketball,Men's Basketball,2019
